URL,Version,Status,OIDs,Name,Title,Descriptino,Uses,Used,Sources
http://fhir.org/guides/hrsa/uds-plus/ValueSet/uds-plus-birthsex-codes,1.0.1,active,,UdsPlusBirthSexCodes,Uds Plus Birth Sex Codes,"The Uds Plus Birth Sex Codes is a set of codes for identifying the birth sex of Patients.",,"THO (V3)"
http://fhir.org/guides/hrsa/uds-plus/ValueSet/uds-plus-gender-identity-codes,1.0.1,active,,UdsPlusGenderIdentityCodes,Uds Plus Gender Identity Codes,"The Uds Plus Gender Identity Codes is a 'starter set' of codes for identifying the gender identity of Patients.",,"THO (V3)"
http://fhir.org/guides/hrsa/uds-plus/ValueSet/uds-plus-insurance-codes,1.0.1,draft,,UdsPlusInsuranceCodes,Uds Plus Insurance Codes,"The Uds Plus Insurance Codes is a 'starter set' of codes for identifying the source of the insurance for Patients.",,"Internal"
http://fhir.org/guides/hrsa/uds-plus/ValueSet/uds-plus-service-delivery-codes,1.0.1,active,,UdsPlusServiceDeliveryCodes,Uds Plus Service Delivery Codes,"The UDS Plus CodeSystem is an 'addition set' of one code to the existing Location Service Delivery Codes value set for UDS+ purposes.",,"Internal,THO"
http://fhir.org/guides/hrsa/uds-plus/ValueSet/uds-plus-sexual-orientation-codes,1.0.1,active,,UdsPlusSexualOrientationCodes,Uds Plus Sexual Orientation Codes,"The Uds Plus Sexual Orientation Codes is a 'starter set' of codes for identifying the sexual orientation of Patients.",,"THO (V3),FHIR"
http://fhir.org/guides/hrsa/uds-plus/ValueSet/udsplus-agriculture-worker-status,1.0.1,draft,,UdsPlusAgricultureWorkerStatusCodes,Uds Plus Agriculture Worker Status Codes,"The Uds Plus Agriculture Worker Status Codes is a 'starter set' of codes for specifying agriculture worker status for Patients.",,"Internal"
http://fhir.org/guides/hrsa/uds-plus/ValueSet/udsplus-housing-status,1.0.1,draft,,UdsPlusHousingStatusCodes,Uds Plus Housing Status Codes,"The Uds Plus Housing Status Codes is a 'starter set' of codes for identifying the Patient's housing status.",,"Internal"
